question,answer,keywords
Read the following questions and answer as per the direction given below: Statement I: Alkali metals dissolve in liquid ammonia to give blue solutions. Statement-II: Alkali metals in liquid ammonia give solvated species of the type [M(NH3 )n] + (M = alkali metals). A. Statement I is true; Statement II is true; Statement II is a correct explanation of Statement I. B. Statement I is true; Statement II is true; Statement II is not the correct explanation of Statement I. C. Statement I is true; S...,Na + + (x + y)NH3 → [Na(NH3 ) x] + + [e(NH3 )y] - Ammoniated electrons Alkali metals dissolve in liquid ammonia giving deep blue solutions which are conducting in nature. The blue colour of the solution is due to ammoniated electrons which absorb energy in the visible region of light. The second statement describes the solvated cations (positively charged species) whereas the colour is due to the solvated electrons. Do note however that both the statements are accurate.,electron energy atomic_structure
A sodium salt when treated with MgCl2 gives white precipitate only on heating. The anion is: A. SO4 2- B. HCO3 - C. CO3 2- D. NO3 -,"It must be a bicarbonate ion because first magnesium bicarbonate is formed which is soluble. Then on heating, magnesium carbonate is formed which is insoluble and forms a precipitate. The anion is HCO3 - .",thermodynamics heat carbon
"The species that do not contain peroxide ions, is A. PbO2 B. H2O2 C. SrO2 D. BaO2","PbO2 is the Lead (IV) oxide. It is not a peroxide whereas the H2O2 , SrO2 , and BaO2 are all peroxides. O2 -2 is the peroxide anion.",physics chemistry problem solving
The set representing the correct order of first ionisation potential is A. K > Na > Li B. Be > Mg > Ca C. B > C > N D. Ge > Si > C,The ionisation energy decreases down the group with an increase in size. These elements ( Be > Mg > Ca ) are 2nd group elements and the order correctly reflects the trend in ionization energy.,energy potential
Give reason for the following: BeCl2 can be easily hydrolysed.,BeCl2 is electron-deficient species so it can be easily hydrolysed. BeCl2 + 4H2O → [Be(H2O)4 ]Cl2,electron atomic_structure
"The following compounds have been arranged in order of their increasing thermal stabilities. Identify the correct order. K2CO3 (I), MgCO3 (II), CaCO3 (III), BeCO3 (IV) A. I < II< III< IV B. IV < II< III< I C. IV < II< I< III D. II< IV < III< I","On increasing the size of alkaline earth metal ions, stability of their carbonate salts increases due to increasing polarity, Alkali metal carbonates are more stable than carbonates of alkaline earth metals due to their higher polar characters, Thus, the correct order of stability is IV < II< III< I.",compound carbon
. A substance absorbs CO2 and violently reacts with water. The substance is: A. CaCO3 B. CaO C. H2SO4 D. ZnO,The reactions are as follows. Ca + CO2 → CaCO3 CaO + H2O → Ca (OH)2,reaction
MgSO4 on reaction with NH4OH and Na2HPO4 forms a white crystalline precipitate. What is its formula? A. Mg(NH4 )PO4 B. Mg3 (PO4 )2 C. MgCl2 . MgSO4 D. MgSO4,There is a formation of a white precipitate of magnesium ammonium phosphate when MgSO4 reacts with NH4OH and Na2HPO4 . MgSO4 + Na2HPO4 + NH4OH → Mg(NH4 )PO4↓ + Na2SO4 + H2O White ppt.,ph reaction formula
"Molar conductivity (∧m) of an aqueous solution of sodium stearate, which behaves as a strong electrolyte, is recorded at varying concentrations (c) of sodium stearate. Which one of the following plots provides the correct representation of micelle formation in the solution? (critical micelle concentration (CMC) is marked with an arrow in the figures).","Sodium stearate → CH3 (CH2 )16COO -Na + At normal or low concentration, it behaves as a strong electrolyte and for strong electrolytes, molar conductance (∧m) decreases with an increase in concentration. But for the above particular concentration, sodium stearate forms aggregates and that concentration is called CMC. However, beyond CMC, the ions get associated and form micelles. So the number of charge carriers decreases even further. So further beyond CMC, the molar conductivity decreases more abruptly. Since the number of ions decreases, hence ∧m decreases.",ratio plot concentration
. The conductance of a 0.0015M aqueous solution of a weak monobasic acid was determined by using a conductivity cell consisting of platinized Pt electrodes. The distance between the electrodes is 120 cm with an area of cross-section of 1cm2 . The conductance of this solution was found to be 5 × 10 -7S. The pH of the solution is 4. The value of limiting molar conductivity (Λom) of this weak monobasic acid in an aqueous solution is Z × 10 2 S cm-1 mol -1 . The value of Z is.,"Let’s assume a weak monobasic acid HA. It dissociates as per the equation: HA(aq) ⇌ H + (aq) + A - (aq) From this equation: [H + ]equilibrium = c × α And as pH is given to be equal to 4 ∴ [H + ] = 10 -4 M = = c × α From the above α can be calculated as: α = [H + ] / [HA] = 10 -4 / 0.0015 α = 1/15 Also, the conductivity k = G × ℓ / A Putting the values we get, K = 5 × 10 -7 × 120 / 1 = 6 × 10 -5 S cm-1 And, λm = k × 1000 / M Putting Values: = 5 × 10 -5 × 10 3 / 15 × 10 -4 = 40 S cm-1 mol -1 Now from the expression; α = λm / λm o Putting the values: 1 / 15 = 40 / Z × 10 2 Therefore, Z = 40 × 15 / 100 = 6",calculate equation acid ph equilibrium chemical_equilibrium electrode
"Consider an electrochemical cell: A(s) | An+ (aq, 2 M) || B2n+ (aq, 1 M) | B(s). The value of ΔHθ for the cell reaction is twice that of ΔGθ at 300 K. If the emf of the cell is zero, the ΔSθ (in J K−1 mol−1) of the cell reaction per mole of B formed at 300 K is ____. (Given: ln(2) = 0.7, R (universal gas constant) = 8.3 J K−1 mol−1. H, S and G are enthalpies, entropy and Gibbs energy, respectively.)","A(s) | An + (aq, 2 M) || B 2n+ (aq, 1 M) | B(s) 2A(s) → An n+ + 2ne - B 2n+ + 2ne - → B(s) 2A(s) + + B 2n+→ An n+ + B(s) Q = [A n+ ] 2 / B 2n+ = 2 × 2/ 1 = 4 ΔG o = ΔH o − TΔS o ΔH o = 2ΔG o E o cell = RT / 2nF ln 4 ΔG o = -2n × F × RT / 2nF ln 4 ΔG o = -RT ln 4 ΔS o = ΔH o - ΔG o / T = ΔG o / T = RT ln 4 / T ΔS o = - 8314 × 1.4 ΔS o = -11.62 J mol -1 K -1",energy electrochemical reaction
"For the electrochemical cell, Mg(s)|Mg2+(aq, 1M)||Cu2+ (aq, 1M) | Cu(s) the standard emf of the cell is 2.70 V at 300 K. When the concentration of Mg2+ is changed to x M, the cell potential changes to 2.67 V at 300 K. The value of x is____. (given, F/R = 11500 KV–1, where F is the Faraday constant and R is the gas constant, ln(10) = 2.30).",Mg(s) + Cu 2+ (aq) → Mg 2+ (aq) + Cu(s) E o cell = 2.70; Ecell = 2.67; Mg 2+ = x M; Cu 2+ = 1 M Ecell = E o cell − RT / nF lnx 2.67 = 2.70 − RT / 2Flnx −0.03=−2FR×300×lnx lnx = 0.03 × 2 / 300 × F / R lnx = 0.03 × 2 × 11500 / 300×1 lnx = 2.30 = ln(10) ∴ x = 10,ratio potential electrochemical concentration
"The molar conductivity of a solution of a weak acid HX(0.01 M) is 10 times smaller than the molar conductivity of a solution of a weak acid HY(0.1 M). If λ o x ≈ λ o y , the difference in their pKa values, pKa (HX) − pKa (HY), is (consider the degree of ionization of both acids to be <<1).",α1 / α2 = ∧m(HX) / ∧o m (HX) / ∧m(HY) / ∧o m (HY) = 1 / 10 Ka (HX) / Ka (HY) = C1α 2 1 / C2α 2 2 = 0.01 / 0.1 × (1 / 10) 2 =1 / 1000 log Ka (HX) − logKa (HY) = −3 ∴ pKa (HX) − pKa (HY) = 3,acid
"All the energy released from the reaction X → Y, ∆r G o = -193J mol -1 is used for oxidizing M+ as M+ → M3 + + 2e - , E o = -0.25V. Under standard conditions, the number of moles of M+ oxidized when one mole of X is converted to Y is [F = 96500 C mol -1 ].","M+ → M3 + + 2e - Given X → Y, ∆r G o = -193J mol -1 △G o for above reaction is: △G o = −nF E o = −2 × 96500 × (−0.25) = 48250 J/mol = 48.25k J/mol ∴ The number of moles of M+ oxidised from (X→Y). = 193 / 48.25 = 4",energy reaction
"In a galvanic cell, the salt bridge: A. Does not participate chemically in the cell reaction B. Stops the diffusion of ions from one electrode to another C. Is necessary for the occurrence of the cell reaction D. Ensures mixing of the two electrolytic solutions","A salt bridge, in electrochemistry, is a laboratory device used to connect the oxidation and reduction half cells of a galvanic cell(voltaic cell), a type of electrochemical cell. It maintains electrical neutrality within the internal circuit, preventing the cell from rapidly running its reaction to equilibrium. If no salt bridge were present, the solution in the one-half cell would accumulate a negative charge and the solution in the other half cell would accumulate a positive charge as the reaction proceeded, quickly preventing further reaction, and hence the production of electricity. Salt bridge keeps the solutions in two half-cells electrically neutral. It prevents transference or diffusion of the ions from one half-cell to the other",electrochemical equilibrium chemical_equilibrium oxidation reduction reaction electric electrode
"Consider a 70% efficient hydrogen-oxygen fuel cell working under standard conditions at 1 bar and 298 K. Its cell reaction is; H2 (g) + ½ O2 (g) → H2O(l) The work derived from the cell on the consumption of 1.0 × 10 -3 mol of H2 (g) is used to compress 1.00 mol of a monoatomic ideal gas in a thermally insulated container. What is the change in the temperature (in K) of the ideal gas? The standard reduction potentials for the two half-cells are given below. O2 (g) + 4H+(aq) + 4e - → 2 H2O (l),...","For given reaction: H2 (g) + ½ O2 (g) → H2O(l) E o = 1.23 V ∆G o = –nF E o cell {-2 x 96500 x 1.23} J Since, Work derived from this fuel cell = 70 / 100 x (-∆G o cell) x 10 -3 = x J Since insulated vessel, hence q = 0 From equation, for monoatomic gas, w = ∆U ⇒ x = nCv , m∆T; {CV,m = 3R / 2} Or 70 / 100 x (2 × 96500 × 1.23) × 10 -3 = 1 × 3 / 2 × 8.314 × ∆T ∴ ∆T = 13.32",potential equation reduction reaction hydrogen atom temperature
"For the following cell, Zn(s) | ZnSO4 (aq) || CuSO4 (aq) | Cu(s) when the concentration of Zn 2+ is 10 times the concentration of Cu 2+ , the expression for ΔG (in J mol–1) is [F is Faraday constant; R is gas constant; T is temperature; E° (cell) = 1.1V]. A. 1.1F B. 2.303RT – 2.2F C. 2.303RT + 1.1F D. – 2.2F","Zn + Cu 2+ (aq) → Zn 2+ (aq) + Cu We know that, E = E o − RT / nF ln [Zn 2+ ] / [Cu 2+ ] ∴ E = 1.1 − RT / 2F ln10 Now, ΔG = −nFE Here n = 2 ∴ △G = −2F[1.1 − RT / 2F ln10] = −2.2F + RT log10 10 × 2.303 ∴ △G = 2.303RT − 2.2F",ratio temperature concentration
AgNO3 (aq.) was added to an aqueous KCl solution gradually and the conductivity of the solution was measured. The plot of conductance (Λ) versus the volume of AgNO3 is.,"Initially, to the solution of KCl, solution of AgNO3 added, AgCl(s) is formed. Hence, the conductivity of the solution is almost compensated (or slightly increased) by the formation of KNO3 . After the endpoint, conductivity increases more rapidly because of the addition of excess AgNO3 solution. The plot of conductance (Λ) versus the volume of AgNO3 is as given by (S). This is as explained below. Initial conductance (Λ) of the solution was due to K(aq.)+ and Cl(aq.)−. On addition of AgNO3 , the reaction occurs as, AgNO3 (aq.) + KCl(aq.) → AgCl↓ + KNO3 AgNO3 acts as a limiting reagent up to complete precipitation. The conductance up to precipitation is a straight line parallel to the x-axis due to the replacement of Cl - ions with NO3 - ions (ionic mobility of NO3",plot volume reaction ionic
"The option(s) with only amphoteric oxides is(are) A. Cr2O3, BeO, SnO, SnO2 B. Cr2O3, CrO, SnO, PbO C. NO, B2O3, PbO, SnO2 D. ZnO, Al2O3, PbO, PbO2","Amphoteric oxides are Cr2O3, BeO, SnO, SnO2, ZnO, Al2O3, PbO, PbO2 NO is a neutral oxide CrO is a basic oxide B2O3 is an acidic oxide",ph acid
"The statement that is not correct for periodic classification of elements is. A. The properties of elements are the periodic functions of their atomic numbers B. Nonmetallic elements are less in number than metallic elements. C. For transition elements, the 3d-orbitals are filled with electrons after 3p-orbitals and before 4s-orbitals. D. The first ionisation enthalpies of elements generally increases with an increase in atomic number as we go along a period.","In cases of transition elements (or any elements), the order of filling of electrons in the various orbital is 3p < 4s <3d, Thus 3d orbital is filled when 4s orbital gets completely filled (Aufbau Principle). According to Aufbau Principle, the ground state of an atom or ion e_s fill atomic orbitals of the lowest available energy levels before occupying higher levels.",electron orbit energy atom atomic_structure
"The 1st, 2nd, and the 3rd ionization enthalpies, 𝐼1, 𝐼2, and 𝐼3, of four atoms with atomic numbers n, 𝑛 + 1, 𝑛 + 2, and 𝑛 + 3, where 𝑛 < 10, are tabulated below. What is the value of n?","According to the tabulated data, Element with Atomic number (n + 2), should be an alkali metal As we see, the first ionization enthalpy (I1) is very less but the second ionization enthalpy (I2) is very large. Hence, the atomic number can be = 11 That is, (n + 2) = 11 n = 9 Note: ‘n’ can’t be ‘1’.",atom
"Among the following, O, Cl, F, N, P, Sn, Tl, Na, Ti The number of elements showing only one non – zero oxidation state is","Only F and Na show only one non – zero oxidation state. Thus, the number of elements showing only one non-zero oxidation state is 2. Na exhibits +1 and F exhibits only -1 oxidation state are the two elements. O = O–, O2-, O2+ Cl = -1 to + 7 N = -3 to +5 P = -3 to + 5 Sn = +2, +4 Tl = +1, +3 (rare but does exist) Ti = +2, +3, +4.",oxidation
. Which of the following has the maximum number of unpaired electrons? A. Mg2+ B. Fe2+ C. Ti3+ D. V3+,Mg2+ = 1s2 2s2 2p6 = no unpaired electron Ti3+ = 1s2 2s2 2p6 3p6 3d1 = one unpaired electron V3+ = 1s2 2s2 2p6 3s2 3p6 3d2 = two unpaired electron Fe2+ = 1s2 2s2 2p6 3s2 3p6 3d6 = four unpaired electron,electron atomic_structure
The correct order of radii is A. N < Be < B B. F– < O2- < N3- C. Na < Li < K D. Fe3+ < Fe2+ < Fe4+,"The correct order of radii is F– < O2- < N3-. These all are isoelectronic species. They all have 10 electrons. As the negative charge increases, the atomic size increases. Also, the size of isoelectronic decreases with an increase in atomic number.",electron atomic_structure atom
". The electronegativity of the following elements increases in the order A. C, N, Si, P B. N, Si, C, P C. Si, P, C, N","In general, electronegativity increases across a period from left to right and decreases down the group. Si < P < C < N is the correct order of electronegativity.",electron atomic_structure
"Atomic radii of fluorine and neon in Angstrom units are respectively given by: A. 0.72, 1.60 B. 1.60, 1.60 C. 0.72, 0.72 D. None of these values","The atomic radii of fluorine and neon in the Angstrom unit are 0.72 and 1.60. The atomic radii generally decrease across the period due to an increase in the effective nuclear charge with the increase in the atomic number. The outer electrons go to the same valance shell, hence, it results in the increased attraction of electrons to the nucleus. The non-bonded radii of noble gases are very large due to completely filled orbitals. It is larger than the precedent elements of the same period due to completely filled orbitals and interelectronic repulsion.",electron orbit bond atom atomic_structure
"Identify the correct order of acidic strength of CO2, CuO, CaO, H2O. A. CaO < CuO < H2O < CO2 B. H2O < CuO < CaO < CO2 C. CaO < H2O < CuO < CO2 D. H2O < CO2 < CaO < CuO","CO2 is an acidic oxide, H2O is neutral, CaO is a strong base and CuO is a weak base. Therefore, the order of acid strength is: CaO < CuO < H2O < CO2",acid base
"Amongst the following elements (whose electronic configurations are given below), the one having the highest ionisation energy is. A. [Ne] 3s2 3p1 B. [Ne] 3s2 3p3 C. [Ne] 3s2 3p2 D. [Ar] 3d10 4s2 4s2 4p3","[Ne] 3s2 3p3 has the highest ionisation energy, periodic trend. The ionisation energy increases (with increasing atomic number) along a period and decreases down the group. Also, IE of 15 is more than group 16 as group 15 has a half-filled p subshell giving extra stability.",electron ratio energy atom atomic_structure
"On complete hydrogenation, natural rubber produces. A. Polyethylene B. Ethylene-propylene copolymer C. Polyvinyl chloride D. Polypropylene","On complete hydrogenation, natural rubber produces. A. Polyethylene B. Ethylene-propylene copolymer C. Polyvinyl chloride D. Polypropylene",polymer hydrogen
In the following reactions compound x is;,The compound X is 2-phenylethanol. The triple bond of ethynylbenzene is selectively hydrogenated to double bond by using Lindlar's catalyst to obtain styrene. Hydroboration oxidation of styrene gives 2-phenylethanol (compound X),bond ratio ph oxidation reaction hydrogen catalyst compound
"Isomers of hexane, based on their branching, can be divided into three distinct classes as shown in the figure.","More the branching in an alkane, lesser will be the surface area, lesser will be the boiling point as weaker will be the intermolecular attractive forces.",force isomer base
The bond energy (in kcal mol -1 ) of a C−C single bond is approximately: A. 1 B. 10 C. 100 D. 1000,C-C single bond dissociation energy range is between 88 to 150 Kcal mol1 -1 C-C bond energy = 348J/mol = 348 / 4.2 kcal/mol = 82.85 kcal/mol ≈ 100 kcal/mol,energy bond
The total number of stereoisomers that can exist for M is,The total number of stereoisomers is 2. This molecule can not show geometrical isomerism so only mirror image will be other stereoisomer.,molecule isomer
The total number(s) of stable conformers with non-zero dipole moment for the following compound is (are): A. 2 B. 4 C. 3 D. 5,Three stable (staggered) conformers exist (with μ≠0),compound
"Newman projections P, Q, R and S are shown below: Which one of the following options represents identical molecules? A. P and Q B. Q and S C. Q and R D. R and S",c,molecule
"On monochlorination of 2-methylbutane, the total number of chiral compounds obtained is. A. 2 B. 4 C. 6 D. 8","During the monochlorination of 2 methyl butane, four compounds are possible however only two of them will be chiral in nature. Here, I and III are chiral.",compound
Which of the following reaction produce propane as a major product?,b c,reaction
The correct statement(s) for the following addition reactions is(are)A. O and P are identical molecules B. (M and O) and (N and P) are two pairs of diastereomers C. (M and O) and (N and P) are two pairs of enantiomers D. Bromination proceeds through trans-addition in both the reactions,(B) (M and O) and (N and P) are two pairs of diastereomers. They have the same configuration at one chiral carbon atom and a different configuration at other chiral carbon atoms. ( D ) B r o min a tio n p r o c e e d s t h r o u g h t r a n s - a d ditio n in b o t h r e a c tio n s. It in v olv e s t h e fo r m a tio n o f c y clic b r o m o niu m io n s.,carbon ratio molecule reaction atom
"To measure the quantity of MnCl2 dissolved in an aqueous solution, it was completely converted to KMnO4 using the reaction, MnCl2 + K2S2O8 + H2O → KMnO4 + H2SO4 + HCl (equation not balanced). Few drops of concentrated HCl were added to this solution and gently warmed. Further, oxalic acid (225 g) was added in portions till the colour of the permanganate ion disappeared. The quantity of MnCl2 (in mg) present in the initial solution is _____. (Atomic weights in g mol–1 : Mn = 55, Cl = 35.5)",MnCl2 + K2S2O8 + H2O → KMnO4 + H2SO4 + HCl meq of C2O4 2- = meq of MnO4 - 2 × 225 / 90 = a × 5 ⇒ a = 1 w = 1 × [55+71] = 126 mg,acid equation reaction atom
The difference in the oxidation numbers of the two types of sulphur atoms in Na2S4O6 is:,"The structure of Na2S4O6 is; The oxidation number of sulphur atom involved in coordinate bond formation is (+5) and that of the middle sulphur atom is zero. Hence, the difference in oxidation number of the two types of sulphur atoms will be (+5). ∴ The difference in the O.S of the two types of sulphur atoms is 5 - 0 = 5.",oxidation bond ph atom
For the reaction: I - + ClO -3 + H2SO4 → Cl - + HSO4 - + I2 The correct statement(s) in the balanced equation is/are: A. Stoichiometric coefficient HSO4 - of is 6 B. Iodide is oxidized C. Sulphur is reduced D. H2O is one of the products,"The balanced equation is: 6I - + ClO -3 + 6H2SO4 → Cl - + 6HSO4 - + 3I2 + 3H2O Here you will see that iodine is oxidised and the stoichiometric coefficient of HSO4 - is 6. Additionally, water is formed on the product side.",ph equation reaction
". The pair of compounds having metals in their highest oxidation state is: A. MnO2 , FeCl3 B. [MnO4] - , CrO2Cl2 C. [Fe(CN)6] 3- , [Co(CN)3] D. [NiC14] 2- , [CoC14] -",a. The oxidation state of Mn in MnO2 is +4 The oxidation state of Fe in FeCl3 is +3 b) The oxidation state of Mn in [MnO4] - is +7 The oxidation state of Cr in CrO2Cl2 is +6 c) The oxidation state of Fe in [Fe(CN)6] 3- is +3 The oxidation state of Co in [Co(CN)3] is +3 d) The oxidation state of Ni in [NiC14] 2- is +2 The oxidation state of Co in [CoC14] - is +3,compound oxidation
Consider a titration of potassium dichromate solution with acidified Mohr's salt solution using diphenylamine as an indicator. The number of moles of Mohr's salt required per mole of dichromate is: A. 3 B. 4 C. 5 D. 6,The redox reaction between potassiumdichromate and Mohr's salt is: 6Fe 2+ + Cr2O7 2- + 14H + → 6Fe 3+ + 2Cr 3+ + 7H2O Mohr’s salt: Fe2SO4 .(NH4)2SO4 .6H2O Dichromate will oxidise Fe 2+ from Mohr's salt to Fe 3+ .,acid ratio ph titration reaction
"6. Which ordering of compounds is according to the decreasing order of the oxidation state of nitrogen? A. HNO3 , NO, NH4Cl, N2 B. HNO3 , NO, N2 , NH4Cl C. HNO3 , NH4Cl, NO, N2 D. NO, HNO3 , NH4Cl, N2","Let the oxidation state of nitrogen = x HNO3 : (+1) + X + 2(-3), x = +5 NO: x + (-2), x = +2 NH4CI: X + 4(+1) + (-1), X = -3 N2 : 2x = 0, x = 0 So the correct order will be HNO3 , NO, N2 , NH4Cl",compound oxidation
"Young's modulus of elasticity Y is expressed in terms of three derived quantities, namely, the gravitational constant G, Planck's constant h and the speed of light c, as Y = ca h b G g . Which of the following is the correct option ?","Sol. Y chG ab g = ML T (LT ) (ML T ) (M L T ) - - -a -b - - g 1 2 1 2 1 13 2 = 1 = b – g ...(1) –1 = a + 2b + 3g ...(2) –2 = – a – b – 2g ...(3) –3 = b + g 1 = b – g –2 = 2b Þ b = –1, g = –2 –1 = a – 2 – 6 \\ a = 7",optics modern physics elastic modulus gravitation
"A particle of mass m is moving in the xy-plane such that its velocity at a point (x, y) is given as =a + ( ) ˆ ˆ 2 r v yx xy , where a is a non-zero constant. What is the force r F acting on the particle ?",Sol. v (yx 2xy) =a +ˆ ˆ r x v y = a y v 2x = a dvx dy 2 2 x dt dt =a = a y 2 x dv 2v 2 y dt =a =a 2 \\= =a + F ma 2m (xx yy),mechanics
"An ideal gas is in thermodynamic equilibrium. The number of degrees of freedom of a molecule of the gas in n. The internal energy of one mole of the gas is Un and the speed of sound in the gas is vn. At a fixed temperature and pressure, which of the following is the correct option ?","Sol. 1 frT U fnrT 2 2 = = \\ A and B are wrong. sound RT 2 RT v 1 M fM g æ ö = =+ ç ÷ è ø Þ more 'f', less 'v' 5 7",thermodynamics waves fluid mechanics energy ideal_gas
"A thin circular coin of mass 5 gm and radius 4/3 cm is initially in a horizontal xy-plane. The coin is tossed vertically up (+ݖ direction) by applying an impulse of –2 10 N-s 2 p ´ at a distance 2/3 cm from its center. The coin spins about its diameter and moves along the +ݖ direction. By the time the coin reaches back to its initial position, it completes ݊ rotations. The value of n is ____. [Given: The acceleration due to gravity g = 10 ms–2]",(30) Sol. J = mv ......(1) Jr = Icw ........(2) JC = 1 mR2 4 ........(3) 2v t g = ........(4) q= p =w 2N t .......(5) \\ N = 30,mechanics
"A string of length 1 m and mass 2 × 10–5 kg is under tension T. when the string vibrates, two successive harmonics are found to occur at frequencies 750 Hz and 1000 Hz. The value of tension T is _______ Newton.",(5) Sol. = l P T f 2 µ P T 750 2 = m ......(1) P1T 1000 2 + = m .....(2) 4 P1 3 P + = \\ P = 3 Þ 1000 = 5 4 T 2 2 10- ´ \\ T =5N,mechanics
"In a radioactive decay process, the activity is defined as d d = - N A t , where N(t) is the number of radioactive nuclei at time t. Two radioactive sources, S1 and S2 have same activity at time t = 0. At a later time, the activities of S1 and S2 are A1 and A2, respectively. When S1 and S2 have just completed their 3rd and 7th half-lives, respectively, the ratio A1 /A2 is __________.",(16) Sol. 1 2 0 0 1 2 S S t0A A t AA = = t ( ) ( ) ( ) ( ) ( ) ( ) 1/2 1 1/2 2 t/ t 3 01 4 t/ t 7 2 0 A 0.5A 0.5 2 16,modern physics
