question,answer,keywords
"A container has a base of 50 cm × 5 cm and height 50 cm, as shown in the figure. It has two parallel electrically conducting walls each of area 50 cm × 50 cm. The remaining walls of the container are thin and non-conducting. The container is being filled with a liquid of dielectric constant 3 at a uniform rate of 250 cm3 s−1. What is the value of the capacitance of the container after 10 seconds? [Given: Permittivity of free space 0 = 9 × 10−12 C2 N−1m−2, the effects of the non-conducting walls on the capacitance are negligible] 50 cm 5 cm 50 cm",Sol. In t = 10 sec volume of liquid is V = 2500 cc 2500 h 10cm 50 5    d 0 d A k C d   2 2 0 0 2 50 10 10 10 3 3 5 10             2 2 a 0 0 a 0 2 A 50 10 40 10 C 4 d 5 10              C = Ca + Cd = 70 = 7 × 9 × 10–12 = 63 Pf,electromagnetism capacitance
"One mole of an ideal gas expands adiabatically from an initial state (TA, V0) to final state (Tf, 5𝑉0). Another mole of the same gas expands isothermally from a different initial state (TB, V0) to the same final state (Tf, 5V0). The ratio of the specific heats at constant pressure and constant volume of this ideal gas is . What is the ratio TA /TB?",TV T(5V)    1 A A f B T T 5 T T   ,thermodynamics fluid mechanics ideal_gas
"Two satellites P and Q are moving in different circular orbits around the Earth (radius R). The heights of P and Q from the Earth surface are hP and hQ, respectively, where hp = R/3. The accelerations of P and Q due to Earth’s gravity are gP and gQ, respectively. If gP /gQ = 36/25, what is the value of hQ?",g r r        2 Q P r 36 25 r       Q P r 6 r 5 Q P 6 r r 5 Q 6 R R h R 5 3          Q 24 9 3 h R R R R 15 15 5    ,mechanics
"A Hydrogen-like atom has atomic number Z. Photons emitted in the electronic transitions from level n = 4 to level n = 3 in these atoms are used to perform photoelectric effect experiment on a target metal. The maximum kinetic energy of the photoelectrons generated is 1.95 eV. If the photoelectric threshold wavelength for the target metal is 310 nm, the value of Z is _______. [Given: hc = 1240 eV-nm and Rhc = 13.6 eV, where R is the Rydberg constant, h is the Planck’s constant and c is the speed of light in vacuum]",(3)n = 4 n = 3 –1.51Z2eV –0.85 Z2 eV E = E4 – E3 = 0.66 Z2 eV Kmax = E – W 0.66 Z2 1.95 + 4 = 5.95 hc 1240  2 W 0.66Z 1.95      Z = 3 9. 310,mechanics electromagnetism optics waves modern physics energy
"A closed container contains a homogeneous mixture of two moles of an ideal monatomic gas ( = 5/3) and one mole of an ideal diatomic gas ( = 7/5). Here,  is the ratio of the specific heats at constant pressure and constant volume of an ideal gas. The gas mixture does a work of 66 Joule when heated at constant pressure. The change in its internal energy is ________ Joule.",(121)Sol. At constant pressure W = nRT = 66 U = n(CV)mixT   1 2 1 V 2 V V mix 1 2 nC nC C n n     V mix 3 5 2 R 1 R 2 2 C 3      V mix 11 C R6    11 U nRT 6    11 U 66 121J 6    ,mechanics thermodynamics modern physics fluid mechanics energy ideal_gas
"A person of height 1.6 m is walking away from a lamp post of height 4 m along a straight path on the flat ground. The lamp post and the person are always perpendicular to the ground. If the speed of the person is 60 cm s−1, the speed of the tip of the person’s shadow on the ground with respect to the person is _______ cm s−1.",(40)4 1.6 y y x   4y – 4x = 1.6y 2.4 y = 4x X = 0.6y dx dy 0.6 dt dt   dy 60 0.6 dt   dy 100cm/s dt   Speed of tip of person’s Shadow w.r.t person = 100 – 60 = 40 cm/s,
"List-I shows different radioactive decay processes and List-II provides possible emitted particles. Match each entry in List-I with an appropriate entry from List-II, and choose the correct option. List-I List-II (P) 238 234 92 91 U Pa (1) one  particle and one  + particle (Q) 214 210 82 82 Pb Pb (2) three  – particles and one  particle (R) 210 206 81 82 Tl Pb (3) two  – particles and one  particle (S) 228 224 91 88 Pa Ra (4) one  particle and one  – particle (5) one  particle and two  + particles","List-I shows different radioactive decay processes and List-II provides possible emitted particles. Match each entry in List-I with an appropriate entry from List-II, and choose the correct option. List-I List-II (P) 238 234 92 91 U Pa (1) one  particle and one  + particle (Q) 214 210 82 82 Pb Pb (2) three  – particles and one  particle (R) 210 206 81 82 Tl Pb (3) two  – particles and one  particle (S) 228 224 91 88 Pa Ra (4) one  particle and one  – particle (5) one  particle and two  + particles",modern physics
"Consider a spherical gaseous cloud of mass density r(r) in free space where r is the radial distance from its center. The gaseous cloud is made of particles of equal mass m moving in circular orbits about the common center with the same kinetic energy K. The force acting on the particles is their mutual gravitational force. If r(r) is constant in time, the particle number density n(r) = r(r)/m is : [G is universal gravitational constant] (1) 2 2 K rmG p (2) 2 2 K 6 rmG p (3) 2 2 3K rmG p (4) 2 2 K 2 r mG","(4) Sol. Let total mass included in a sphere of radius r be M. For a particle of mass m, 2 2 GMm mv r r = ÞGMm 2K r = Þ M = 2Kr Gm \\dM= 2Kdr Gm m r M Þ(4pr2dr)r = 2Kdr Gm Þr = 2 K 2 rGm p \\n = m r = 2 2 K 2 r mG",mechanics thermodynamics fluid mechanics energy gravitation
"In a radioactive sample, 40 19 K nuclei either decay into stable 40 20 Ca nuclei with decay constant 4.5 × 10–10 per year or into stable 40 18 Ar nuclei with decay constant 0.5 × 10–10 per year. Given that in this sample all the stable 40 20 Ca and 40 18 Ar nuclei are produced by the 40 19 K nuclei only. In time t × 109 years, if the ratio of the sum of stable 40 20 Ca and 40 18 Ar nuclei to the radioactive 40 19 Knuclei is 99, the value of t will be : [Given ln 10 = 2.3] (1) 9.2 (2) 1.15 (3) 4.6 (4) 2.3","(1) JEE(Ada ced) 2019/Pae-1 JEE(Ad a ced) 2019/Pa e-1/Hed M da 27 h Ma , 2019 Sol. Parallel radioactive decay l1 = l l2 = 9l Ca 40 20 K20 19 Ar 20 18 l = l1 + l2 = 5 × 10–10 per year N = N0 e–lt N0 – N = Nstable N = Nradioactive 0N 1 99 N- = 0N 100 N = t 0 N 1 e N 100-l = = Þ lt = 2 ln10 = 4.6 t = 9.2 × 109 year",modern physics decay_constant
"A student uses a simple pendulum of exactly 1m length to determine g, the acceleration due to gravity. He uses a stopwatch with the least count of 1 sec for this and records 40 seconds for 20 oscillations. For this observation, which of the following statement(s) is (are) true?","(A) and (C) Solution: The relative error in the measurement of time, Δt/t = 1s/40s =1/40 Time period, T= 40s/20 =2s Error in the measurement of the time period, ΔT=T× (Δt/t) =2s × (1/40) =0.05s The time period of a simple pendulum is, T =2π√(l/g) Therefore, T2=(4π2l)/g ⇒ g = (4π2l)/T2 Therefore, (Δg/g) = 2ΔT/T =2× (0.05/2) = 0.05 (Δg/g) x 100 = 0.05 x 100 = 5%",mechanics dimensional analysis
"A Vernier Calliper has 1 mm marks on the main scale. It has 20 equal divisions on the Vernier scale which match with 16 main scale divisions. For this Vernier callipers, the least count is","0.2 mm Solution: The least count may be calculated as the ratio between the smallest division on the main scale by the number of divisions on the vernier scale. So, 20 divisions of vernier scale = 16 divisions of main scale. Therefore, 1 VSD = 16/20 = 0.8 mm Also Least count = 1MSD – 1VSD = 0.2 mm",
"The density of a solid ball is to be determined in an experiment. The diameter of the ball is measured with a screw gauge, whose pitch is 0.5 mm and there are 50 divisions on the circular scale. The reading on the main scale is 2.5 mm and that on the circular scale is 20 divisions. If the measured mass of the ball has a relative error of 2%, the relative percentage error in the density is","3.1% Solution: Least count of the screw gauge = 0.5/50 = 0.01 mm Diameter of the ball, D = 2.5 mm + 20(0.01) = 2.5 + 0.2 = 2.7 mm Density, ρ = M/vol The relative percentage error in density = 2% + (3(0.01/2.7)x 100) = 3.1%",mechanics fluid mechanics dimensional analysis
"In the determination of Young’s modulus Y = (4MLg/πld2) by using Searle’s method, a wire of length L = 2m and diameter d = 0.5 mm is used. For a load M = 2.5 kg, an extension l = 0.25 mm in the length of the wire is observed. Quantities d and l are measured using a screw gauge and a micrometre, respectively. They have the same pitch of 0.5 mm. The number of divisions on their circular scale is 100. The contributions to the maximum probable error of the Y measurement.","due to the errors in the measurements of d and l are the same. Solution: Given, Y = (4MLg/πld2) l = 0.25 mm d = 0.5 mm Since the pitch and the number of divisions on the circular scale is the same, Δl = Δd",mechanics dimensional analysis modulus
The diameter of a cylinder is measured using Vernier callipers with no zero error. It is found that the zero of the Vernier scale lies between 5.10 cm and 5.15 cm of the main scale. The Vernier scale has 50 divisions equivalent to 2.45 cm. The 24th division of the Vernier scale exactly coincides with one of the main scale divisions. The diameter of the cylinder is,"The readings on the main scale are 5.10 and 5.15 1 main scale divisions = 0.05 cm 1 vernier scale division, = 2.45/50 = 0.049 cm/div Least count = 0.05 - 0.049 = 0.001 cm Diameter = MSR + (L.C x VSD) = 5.10 + (24 x 0.001) = 5.124 cm",dimensional analysis
")Using the expression 2d sinθ =λ, one calculates the values of d by measuring the corresponding angles θ in the range 0 to 900. The wavelength λ is exactly known and the error in θ is constant for all values of θ. As θ increases from 00","the fractional error in d decreases Solution: 2dsinθ = λ ⇒ d = λ/2sinθ For maximum possible error, all the errors must be added As λ is exactly known, Δλ = 0 ⇒ Δd/d = cotθΔθ As Δθ is a constant, on increasing θ, cotθ will decrease. So, the fractional error (Δd/d) will also decrease",optics waves dimensional analysis
")During Searle’s experiment, zero of the Vernier scale lies between 3.20 x 10-2 m and 3.25 x 10-2 m of the main scale. The 20th division of the Vernier scale exactly coincides with one of the main scale divisions. When an additional load of 2 kg is applied to the wire, the zero of the Vernier scale still lies between 3.20 x 10-2m and 3.25 x 10-2 m of the main scale but now the 45th division of the Vernier scale coincides with one of the main scale divisions. The length of the thin metallic wire is 2m and its cross-sectional area is 8 x 10-7 m2. The least count of the Vernier scale is 1.0 x 10-5 m. The maximum percentage error in Young’s modulus of the wire is","1 cm on the main scale is divided into 8 equal divisions The least count of the vernier is given as 1M.S.D - 1V.S.D Given 5 vernier scale divisions coincides with 4 main scale divisions. 5 V.S.D = 4 M.S.D L.C = 1M.S.D - (⅘) M.S.D = (⅕) M.S.D = (⅕)(⅛) = 1/40 Checking the options (A) and (B) Given pitch of screw gauge twice the least count of the Vernier callipers p = 2 x (1/40) = (1/20) cm The least count of screw gauge is = pitch/number of divisions on the circular scale Number of divisions on the circular scale = (1/20)/100 = 0.0005 cm = 0.005 mm Hence option (B) is correct Checking the option (C) and (D) Given least count of the linear scale of the screw gauge is twice the least count of the Vernier callipers One complete rotation of the circular scale moves it by 2 divisions on the linear scale, so the pitch is 2 times the linear scale division of screw gauge Pitch = 2 x linear scale division of screw gauge = 2 x 2(least count of the vernier callipers) = 4 x (1/40) = 1/10 The least count of the screw gauge = pitch/number of divisions on circular scale = (1/10)/100 = 0.001 cm = 0.01 mm",mechanics dimensional analysis modulus
"The energy of a system as a function of time t is given as E(t) = A2e-αt, where α = 0.2 s-1 . The measurement of A has an error of 1.25%. If the error in the measurement of time is 1.50%, the percentage error in the value of E(t) at t = 5 s is","E(t) = A2e-αt, for a small percentage of error we can do differentiation. dE = 2A(dA)e-αt+ A2(-αe-αtdt) Fractional error, dE/E = [2A(dA)e-αt+ A2(-αe-αtdt)]/A2e-αt = 2(dA/A) + (-α dt) Error is always taken as positive = 2(dA/A) + α dt Percentage of error in E as a function of t = (2(dA/A) + αtdt/t) x 100 = 2(1.25) + (0.2)(1.5)(5) = 2.5 + 1.5 = 4%",dimensional analysis energy
"In an experiment to determine the acceleration due to gravity g, the formula used for the time period of a periodic motion is . The values of R and r are measured to be (60 ± 1) mm and (10 ± 1) , respectively. In five successive measurements, the time period is found to be 0.52 s, 0.56 s, 0.57s, 0.54 s and 0.59 s. The least count of the watch used for the measurement of time period is 0.01 s. Which of the following statement(s) is(are) true?","Values of the time period are found to be 0.52 s, 0.56 s, 0.57s, 0.54 s and 0.59 s The mean value of the time period, T = ΣTi/5 = 2.78/5 = 0.56 s The magnitude of the absolute error in each observation, |△T1| = 0.56 - 0.52 = 0.04 s |△T2| = 0.56 - 0.56 = 0 s |△T3| = 0.57 - 0.56 = 0.01 s |△T4| = 0.56 - 0.54 = 0.02 s |△T5| = 0.59 - 0.56 = 0.03 s Mean absolute error in time period, ΔTm = (0.04 + 0+ 0.01+0.02+0.03)/5 = 0.02 s Error in T, (ΔTm/T) x 100 = (0.02/0.56) x 100 = 3.57% Error in the measurement of r, (Δr/r) x 100 = (1/10) x 100 = 10%",mechanics dimensional analysis
"Two bodies, each of mass M, are kept fixed with a separation 2L. A particle of mass m is projected from the midpoint of the line joining their centres, perpendicular to the line. The gravitational constant is G. The correct statement(s) is (are)",2 2GMm 1mv 0 L 2     GM v 2 L  Note: The energy of mass ‘m’ means its kinetic energy (KE) only and not the potential energy of interaction between m and the two bodies (of mass M each) – which is the potential energy of the system.,mechanics electromagnetism energy gravitation
"A particle of mass m is attached to one end of a mass-less spring of force constant k, lying on a frictionless horizontal plane. The other end of the spring is fixed. The particle starts moving horizontally from its equilibrium position at time t = 0 with an initial velocity u0. When the speed of the particle is 0.5 u0. It collides elastically with a rigid wall. After this collision,","(A, D) 0 v u sin t  (suppose t1 is the time of collision) 0 0 1 u u cos t 2    1t 3    Now the particle returns to equilibrium position at time t2 = 2t1 i.e. 2 3  with the same mechanical energy i.e. its speed will u0 . Let t3 is the time at which the particle passes through the equilibrium position for the second time. PART - I: PHYSICS JEE Advanced 2013 - Paper 2 MathonGo For more such free study materials, visit www.mathongo.com  3 1 T t 2t 2   2 5 3 3          5 m 3 k   Energy of particle and spring remains conserved.",mechanics elastic energy
A steady current I flows along an infinitely long hollow cylindrical conductor of radius R. This cylinder is placed coaxially inside an infinite solenoid of radius 2R. The solenoid has n turns per unit length and carries a steady current I. Consider a point P at a distance r from the common axis. The correct statement(s) is (are),"(A, D) Due to field of solenoid is non zero in region 0 < r < R and non zero in region r>2R due to conductor.",electromagnetism fluid mechanics dimensional analysis magnetic_field
"Two vehicles, each moving with speed u on the same horizontal straight road, are approaching each other. Wind blows along the road with velocity w. One of these vehicles blows a whistle of frequency 1f . An observer in the other vehicle hears the frequency of the whistle to be 2f . The speed of sound in still air is V.The correct statement(s) is (are)","(A, B) If wind blows from source to observer 2 1 V w u f f V w u            When wind blows from observer towards source 2 1 V w u f f V w u            In both cases, 2 1 f f .",mechanics optics waves
"Using the expression 2d sin = , one calculates the values of d by measuring the corresponding angles  in the range  to 90°. The wavelength  is exactly known and the error in  is constant for all values of . As increases from 0°,","d 2sin    lnd ln lnsin 2          JEE Advanced 2013 - Paper 2 MathonGo For more such free study materials, visit www.mathongo.com d cos d 0 d sin      max d d       = cot   Also max ( d) dcot    cot 2sin    2 cos 2sin      As  increases cot decreases and 2 cos sin   also decreases.",optics waves dimensional analysis
"Two non-conducting spheres of radii R1 and R2 and carrying uniform volume charge densities +  and –, respectively, are placed such that they partially overlap, as shown in the figure. At all points in the overlapping region,","(C, D) In triangle PC1C2 2 1 r d r     The electrostatic field at point P is   3 3 1 2 2 1 3 3 1 2 4 4 K R r K R r 3 3 E R R                       2 1 4 E K (r r) 3        0 E d 3     ",electromagnetism
The radius of the orbit of an electron in a Hydrogen-like atom is 4.5 a0 where a0 is the Bohr radius. Its orbital angular momentum is 3h,Given data n 4.5a a Z  0 0  nh 3h 2  2  2 …(i) …(ii) So n = 3 and z = 2 So possible wavelength are 1   1 1   2  1 1 RZ 1 3   2  2  2 1 1 RZ 1 2   2         1 9 32R 9 5R (D) 4 3R 2 2 1  3  2  1 1 RZ 2 3   2  2          2   3 1 3R 9 5R,mechanics optics waves modern physics momentum
"A mixture of 2 moles of helium gas (atomic mass = 4 amu), and 1 mole of argon gas (atomic mass = 40 amu) is kept at 300 K in a container. The ratio of the rms speeds         ) on (arg v ) helium ( v rms rms is :",v Ar He  = 10 4 40 m m He Ar    3.16,mechanics thermodynamics modern physics
"A small block is connected to one end of a massless spring of un-stretched length 4.9 m. The other end of the spring (see the figure) is fixed. The system lies on a horizontal frictionless surface. The block is stretched by 0.2 m and released from rest at t = 0. It then executes simple harmonic motion with angular frequency s/ rad 3   . Simultaneously at t = 0, a small pebble is projected with speed v from point P at an angle of 45º as shown in the figure. Point P is at a horizontal distance of 10 cm from O. If the pebble hits the block at t = 1s, the value of v is (take g = 10 m/s2",Time of flight for projectile T = g sin u2  = 1 sec. g 45 sin u2 = 1 sec. u = 2 g u = 50 m/s,mechanics optics waves harmonic_motion
Three very large plates of same area are kept parallel and close to each other. They are considered as ideal black surfaces and have very high thermal conductivity. The first and third plates are maintained at temperatures 2T and 3T respectively. The temperature of the middle (i.e. second) plate under steady state condition is,In steady state energy absorbed by middle plate is equal to energy released by middle plate. A(3T)4 A(T)4 = A(T)4 A(2T)4 (3T)4 (T)4 = (T)4 (2T)4 (2T)4 = (16 + 81) T4 T = T 2 97 4,thermodynamics energy
n the determination of Youngs modulus,d =  = 100 5.0 mm y = 2d MLg 4             max y y + d d 2 error due to  measurement mm 25 .0 mm 100 /5.0     error due to d measurement 25 .0 100 /5.0 mm 5.0 100 5.0 2 d d 2     So error in y due to  measurement = error in y due to d measurement,mechanics dimensional analysis youngs_modulus modulus
"Youngs double slit experiment is carried out by using green, red and blue light, one color at time. The fringe widths recorded are G , R and B , respectively. Then", = d D VIBGYOR  increase R > G > B So R > G > B,optics
"A person blows into open-end of a long pipe. As a result, a high-pressure pulse of air travels down the pipe. When this pulse reaches the other end of the pipe.","ns. (B), (D) Sol. At open end phase of pressure wave charge by  so compression returns as rarefraction. While at closed end phase of pressure wave does not change so compression return as compression.",thermodynamics electromagnetism optics waves fluid mechanics refraction
"Consider the motion of a positive point charge in a region where there are simultaneous uniform electric and  magnetic fields E 0   E j and B 0  B j . At time t = 0, this charge has velocity v  in the x-y plane, making an angle  with x-axis. Which of the following option(s) is(are) correct for time t > 0 ?",". Sol. (C), (D) If  = 0° then due to magnetic force path is circular but due to force qE0 () q will have accelerated motion along y axis. So combined path of q will be a helical path with variable pitch so (A) and (B) are wrong. If  = 10° then due to vcos, path is circular and due to qE0 and vsin, q has accelerated motion along y-axis so combined path is a helical path with variable pitch (C) is correct. If  = 90° then FB = 0 and due to qE0 motion is accelerated along y-axis. (D",mechanics electromagnetism magnetic_field
"A proton is fired from very far away towards a nucleus with charge Q = 120 e, where e is the electronic charge. It makes a closest approach of 10 fm to the nucleus. The de Brogle wavelength (in units of fm) of the proton at its start is : (take the proton mass, mp = (5/3) × 1027 kg, h/e = 4.2 × 1015 J.s/C ; 0 4 1  = 9 × 109 m/F ; 1 fm = 1015 m",ns. 7 Sol.     15 9 10 10 e e 120 10 9    = m2 p2 p h   2 2 2 h p      2 9 15 27 e 12 10 9 10 10 3 5 2          = 2 2 m2 h  (120) (3)1027+15+9 2 = (4.2)2 × 1030 3 30 2 10 360 10 2.4 2.4        = 29 10 360 42 42    = 72 ×1030  = 7×1015 m = 7 fm,mechanics electromagnetism optics waves modern physics dimensional analysis
"A circular wire loop of radius R is placed in the x-y plane centered at the origin O. A square loop os side a (a << R) having two turns is placed with its center at a = 3R along the axis of the circular wire loop, as shown in figure. The plane of the square loop makes an angle of 45° with respect to the z-axis. If the mutual inductance between the loops is given by R 2 a 2/p 2 0 , then the value of p is",7 Sol. B = 2/3 2 2 2 0 ) X R(2 iR   B = 2/3 2 2 2 0 ) R3 R(2 iR   = 2/3 2 2 0 ) R4(2 iR = R16 i R. 2.2 iR 0 3 2 0     = NBA cos45° = 2 1 aR16 i 2 2 0 R2 8 ia2 0  M = i  R 2 a M 2/7 2 0  = R 2 a 2/P 2 0 P = 7,mechanics inductance
"A dimensionless quantity is constructed in terms of electronic charge e, permittivity of free space 0 constant h, and speed of light c. If the dimensionless quantity is written as e 0 hc and n is a non-zero integer, then ( , , , ) is given by","Sol. 1 3 4 2 2 1 1 [AT] [M L TA ] [MLT ] [LT ] 0 + 2 = 0 + = 0 = 2 3 + 2 + = 0 = + 4 = 0 = ( 2 , , , )",electromagnetism optics modern physics dimensional analysis
"A glass beaker has a solid, plano-convex base of refractive index 1.60, as shown in the figure. The radius of curvature of the convex surface (SPU) is 9 cm, while the planar surface (STU) acts as a mirror. This beaker is filled with a liquid of refractive index n up to the level QPR. If the image of a point object O at a height of h (OT in the figure) is formed onto itself, then, which of the following option(s) is (are) correct?","nswer (A, B) Sol. For image to coincide with object net h f net liq lens mirror 1 1 1 1 2 2 f f f f net 1 1 0.6 1 2 2 9 9 n f From (i) and (ii) 9 (1.6 ) h n",optics
"The specific heat capacity of a substance is temperature dependent and is given by the formula C = kT, where k is a constant of suitable dimensions in SI units, and T is the absolute temperature. If the heat required to raise the temperature of 1 kg of the substance from 73°C to 27 °C is nk, the value of n is ______. [Given: 0 K = 273° C.]",(25000) Sol. / dQm C dT dQ = m·C·dT = 1·kTdT 300 2 2 200 300 200 2 k Q kTdT 4 10 5 2 k = 25000k n = 25000,thermodynamics dimensional analysis
"A disc of mass M and radius R is free to rotate about its vertical axis as shown in the figure. A battery operated motor of negligible mass is fixed to this disc at a point on its circumference. Another disc of the same mass M and radius R/2 that the smaller disc rotates at a uniform angular speed . If the angular speed at which the large disc rotates is /n, then the value of n is _____.",(12) Sol. Conserving angular momentum of the system (bigger disc + smaller disc) about the symmetric axis of bigger disc: 2 2 ( /2) · · 0 2 2 MR MR MR R Where : required angular speed. 2 2 3 2 8 MR MR 12 n = 12,mechanics momentum
